{
  "format_version": "3.0.0",
  "state_id": "GOVERNANCE-COMPACT-CURRENT-STATE-R1",
  "repository": {
    "identity": "inttexsystem/inttracker",
    "canonical_workspace": "D:\\Programação\\controle-tapetes-g28",
    "standalone_git_required": true,
    "branch": "dev",
    "publication": {
      "remote": "staging",
      "branch": "dev",
      "tracking_ref": "refs/remotes/staging/dev",
      "mode": "EXPLICIT_SINGLE_FAST_FORWARD_ONLY"
    }
  },
  "protected_residue": [
    {
      "path": ".gitignore",
      "expected_status": "MODIFIED",
      "handling": "PRESERVE_EXACTLY; DO_NOT OPEN, DISPLAY, COPY, MODIFY, RESTORE, STAGE, COMMIT, REMOVE, CLEAN, OR REINTERPRET"
    },
    {
      "path": ".codex/config.toml",
      "expected_status": "UNTRACKED",
      "handling": "PRESERVE_EXACTLY; DO NOT OPEN, DISPLAY, COPY, MODIFY, RESTORE, STAGE, COMMIT, REMOVE, CLEAN, OR REINTERPRET"
    },
    {
      "path": ".mcp.json",
      "expected_status": "UNTRACKED",
      "handling": "PRESERVE_EXACTLY; DO NOT OPEN, DISPLAY, COPY, MODIFY, RESTORE, STAGE, COMMIT, REMOVE, CLEAN, OR REINTERPRET"
    }
  ],
  "canonical_sources": {
    "agent_behaviour": "docs/governance/AGENT_INSTRUCTIONS.md",
    "current_operational_state": "docs/governance/current-state.json",
    "generated_continuation_view": "AGENT_HANDOFF.md",
    "document_classification": "docs/governance/catalog/documents.json",
    "requirement_traceability": "docs/governance/traceability/purchase-order-phase-c.json",
    "append_only_history": "docs/ledgers/G28_LEDGER.md"
  },
  "accepted_operational_checkpoint": "b77f4d14021781ebd96bce30f625687358b2d87a",
  "accepted_checkpoints": [
    {
      "id": "UI-SPECIALIZED-CONTROLS-B1-SHARED-PRIMITIVES-AND-SITE-MIGRATION",
      "status": "CLOSED / ACCEPTED",
      "checkpoint_commit": "f6986bb4e019671037dc8644f3cec32632848eed",
      "acceptance_scope": "js/ui.js is the sole constructor and css/tokens.css the sole geometry owner for the five role-specific specialized controls; an unknown role or tone throws."
    },
    {
      "id": "PEDIDO-SCREEN-GROUP-1-CREATION-AND-EDITING",
      "status": "CLOSED / ACCEPTED",
      "checkpoint_commit": "ff807a05863c7b8207c2ae5d8813b572001fc935",
      "acceptance_scope": "Pedido creation and editing screens consolidated onto the token card and canonical control rungs; BATCH-03 owns one height for the five fields, not a literal 40px."
    },
    {
      "id": "PEDIDO-SCREEN-GROUP-2-DETAIL-AND-MODAL-SURFACES",
      "status": "CLOSED / ACCEPTED_WITH_NONBLOCKING_EVIDENCE_LIMITATIONS",
      "checkpoint_commit": "cff5e9d2e02fcbee37d082f63fe477d4d6c45878",
      "acceptance_scope": "Pedido detail and modal surfaces consolidated; modal stacking corrected to var(--rv-z-modal); actionButton() owns its own positioning context. No screenshot evidence for that batch."
    },
    {
      "id": "PEDIDO-SCREEN-GROUP-3-LISTS-AND-CLIENT-JOURNEY",
      "status": "CLOSED / ACCEPTED_WITH_NONBLOCKING_EVIDENCE_AND_PROCESS_LIMITATIONS",
      "checkpoint_commit": "264e5d838e43826edc437922041597aa3947015d",
      "acceptance_scope": "Two silent mobile reachability defects found by measurement and corrected with local scroll owners; no stylesheet edited. A document-overflow check alone could not have found them."
    },
    {
      "id": "INTTEX-BRAND-ASSET-INTEGRATION-R1",
      "status": "CLOSED / ACCEPTED",
      "checkpoint_commit": "9af58ae600c14a39acd066395b71a5d5985b50bb",
      "acceptance_scope": "Visible product name is Inttracker and the document title remains Inttracker; the phrase Controle de Tapetes is not restored to visible brand copy. The horizontal wordmark stays where there is measured room and the approved compact symbol is the narrow topbar form below the existing 767px breakpoint. No new logo variant is authorized. Transcript-held screenshots and the fresh-load viewport proof were sufficient; repository-held screenshots are not a standing requirement. The unproved live-resize transition is a nonblocking evidence limitation, not an open acceptance."
    },
    {
      "id": "INTTRACKER-PRODUCTION-CUTOVER-R1",
      "status": "CLOSED / ACCEPTED",
      "checkpoint_commit": "a823b4b66c9fa248b978c5ab6c9ee8ccec66326d",
      "acceptance_scope": "ucrjtfswnfdlxwtmxnoo is the definitive production Supabase project and gqmpsxkxynrjvidfmojk is retired from every active runtime role. No valid separate development or staging database exists, so localhost and preview application environments may resolve read-only to production under the hard write block. Administrative, Auth, service-role and mutation tooling does not inherit that read-only application permission. Physical deletion of the retired project remains separately authorized work."
    },
    {
      "id": "INTTEX-PRODUCTION-ALIAS-CORRECTION",
      "status": "CLOSED / ACCEPTED",
      "checkpoint_commit": "708725325cc20d0c431f203d375e57dc2a9dcd76",
      "acceptance_scope": "The final production alias is recognized by runtime configuration."
    },
    {
      "id": "GOVERNANCE-PROPORTIONAL-EXECUTION",
      "status": "CLOSED / ACCEPTED",
      "checkpoint_commit": "6dd5c04d32aefc68197f69f4472db24aff9eb379",
      "acceptance_scope": "The FAST and ASSURANCE execution profiles and the mandatory execution envelope of docs/governance/AGENT_INSTRUCTIONS.md section 10 are binding."
    },
    {
      "id": "VERCEL-GIT-AUTODEPLOY-RESTORATION",
      "status": "CLOSED / ACCEPTED",
      "checkpoint_commit": "1998817d0a0e9a14228bec7074829df5a6de0f42",
      "acceptance_scope": "Vercel repository health is verified by repository ID 1276430187, never only by the displayed repository name. Production branch is dev, a staging/dev push is expected to trigger Git-sourced deployment automatically, and manual deployment is not the normal publication path."
    },
    {
      "id": "PEDIDO-ADMINISTRATIVE-DUAL-ITEM-ENTRY",
      "status": "CLOSED / ACCEPTED",
      "checkpoint_commit": "7ef4763aaad93196b184700de2146a202d9cc894",
      "acceptance_scope": "Adicionar item opens the detailed modal and the modal must remain; the discreet Adicionar linha action remains at the lower right of the item card and inline editing remains. Both paths converge into the same local item state and persistence contract."
    },
    {
      "id": "PEDIDO-CACHE-TOKEN-GUARD-RECONCILIATION",
      "status": "CLOSED / ACCEPTED",
      "checkpoint_commit": "8fb4afc7ebfe1951238b59f77eea7f859fee9a47",
      "acceptance_scope": "The Pedido dual-entry cache-token conformance guards are reconciled with the shipped runtime asset tokens."
    },
    {
      "id": "ACTIVE-SUPABASE-CONSUMER-SAFETY",
      "status": "CLOSED / ACCEPTED",
      "checkpoint_commit": "00d87530ec50e3adcc45c35c3f66b7b5babba0cb",
      "acceptance_scope": "Active Supabase consumers are reconciled with the production cutover so that no live consumer still writes to the retired project."
    },
    {
      "id": "STAGING-AND-BACKUP-ENVIRONMENT-SAFETY",
      "status": "CLOSED / ACCEPTED",
      "checkpoint_commit": "b77f4d14021781ebd96bce30f625687358b2d87a",
      "acceptance_scope": "Stale staging and backup tooling fails closed. This is the accepted operational checkpoint."
    },
    {
      "id": "PEDIDO-ITEM-PRODUCTION-PRIORITY-END-TO-END-R1",
      "status": "CLOSED / ACCEPTED",
      "checkpoint_commit": "fd59284be1d16a3cefb4abe1dca9253be9f4f165",
      "acceptance_scope": "Production priority between items of one Pedido is implemented end to end. db/91 is applied to the definitive production project. The priority surfaces and the D11.5 Switch standard are accepted. The UI execution-procedure simplification is complete."
    },
    {
      "id": "PEDIDO-MODEL-CREATION-AND-OPTION-LABEL-UI-STABILIZATION-R1",
      "status": "CLOSED / ACCEPTED",
      "checkpoint_commit": "6c828546d80bb596bc5b1e02a48fc32172d9a1eb",
      "acceptance_scope": "The Model modal no longer closes on a backdrop click; the Close, Cancel, Escape, and Save-success close paths remain valid. The field hierarchy (Name, Product type, Width, the full-width explanatory colour-order paragraph, the Color 1/Color 2 row, the model image panel, and Observations) and the explanatory colour text placement are accepted. The Manta width lock (1,40 m, disabled, re-enabled on Tapete) remains correct. The inline Pedido model-option labels include the formatted width, e.g. \"Barcelona – PRETO/CRU · 2,10 m\". Kleber directly validated the rendered result."
    },
    {
      "id": "ADMIN-DASHBOARD-VISUAL-IDENTITY-ALIGNMENT-R1",
      "status": "CLOSED / ACCEPTED",
      "checkpoint_commit": "950725b04e3feb8018c74e86c837182650f0773c",
      "acceptance_scope": "The administrative dashboard visual layer at #/painel conforms to the ratified Inttracker visual identity. Local typography, screen-local pill maps, arbitrary category colours and decorative colour ownership were removed; js/screens/painel.js now inherits the product typography and consumes the canonical badge constructors (rvStatusPill / rvClassificationBadge / rvStageBadge) and the css/tokens.css tokens. Semantic colour survives only where the live condition owns it: lifecycle state, production stage, and real operational caution or negative signal. Information architecture and business behaviour were preserved and unchanged. Kleber directly validated the rendered result. The existing RED expectation-coupling debt owned by UI-SMOKE-TEST-VISUAL-EXPECTATION-COUPLING remains unchanged and did not block acceptance."
    }
  ],
  "active_phase": {
    "id": "ADMIN-PEDIDOS-LIST-VISUAL-IDENTITY-ALIGNMENT-R1",
    "status": "IMPLEMENTED / PUBLISHED / AWAITING SUPERVISOR REVIEW",